<?xml version="1.0" encoding="UTF-8"?>
<xs:schema xmlns="http://tempuri.org/rutas" 
	elementFormDefault="qualified" 
	targetNamespace="http://tempuri.org/rutas" 
	xmlns:xs="http://www.w3.org/2001/XMLSchema">

	<xs:element name="rutas">
		<xs:complexType>
			<xs:sequence>
				<xs:element minOccurs="1" maxOccurs="unbounded" ref="ruta" />
			</xs:sequence>
		</xs:complexType>
	</xs:element>
	<xs:element name="ruta">
		<xs:complexType>
			<xs:sequence>
				<xs:element ref="tipo" />
				<xs:element ref="informacion" />
			</xs:sequence>
			<xs:attribute name="nombre" type="xs:string" use="required" />
			<xs:attribute name="adecuada-para" type="xs:string" use="required" />
			<xs:attribute name="medio-transporte" type="xs:string" use="required" />
		</xs:complexType>
	</xs:element>
	<xs:element name="informacion">
		<xs:complexType>
			<xs:sequence>
				<xs:element ref="horario" />
				<xs:element ref="ubicacion" />
				<xs:element ref="gestion" />
				<xs:element ref="descripcion" />
			</xs:sequence>
		</xs:complexType>
	</xs:element>
	<xs:element name="ubicacion">
		<xs:complexType>
			<xs:sequence>
				<xs:element ref="lugar" />
				<xs:element ref="direccion" />
				<xs:element ref="coordenadas" />
			</xs:sequence>
		</xs:complexType>
	</xs:element>
	<xs:element name="descripcion">
		<xs:complexType>
			<xs:sequence>
				<xs:element ref="texto" />
				<xs:element ref="referencias" />
				<xs:element ref="puntuacion" />
				<xs:element ref="hitos" />
			</xs:sequence>
		</xs:complexType>
	</xs:element>
	<xs:element name="referencias">
		<xs:complexType>
			<xs:sequence>
				<xs:element minOccurs="3" maxOccurs="unbounded" ref="referencia" />
			</xs:sequence>
		</xs:complexType>
	</xs:element>
	<xs:element name="hitos">
		<xs:complexType>
			<xs:sequence>
				<xs:element minOccurs="3" maxOccurs="unbounded" ref="hito" />
			</xs:sequence>
		</xs:complexType>
	</xs:element>
	<xs:element name="hito">
		<xs:complexType>
			<xs:sequence>
				<xs:element ref="texto" />
				<xs:element ref="coordenadas" />
				<xs:element ref="distancia-anterior" />
				<xs:element ref="galeria" />
			</xs:sequence>
			<xs:attribute name="nombre" type="xs:string" use="required" />
		</xs:complexType>
	</xs:element>
	<xs:element name="galeria">
		<xs:complexType>
			<xs:sequence>
				<xs:element maxOccurs="1" ref="fotos" />
				<xs:element maxOccurs="1" ref="videos" />
			</xs:sequence>
		</xs:complexType>
	</xs:element>
	<xs:element name="fotos">
		<xs:complexType>
			<xs:sequence>
				<xs:element minOccurs="1" maxOccurs="5" ref="foto" />
			</xs:sequence>
		</xs:complexType>
	</xs:element>
	<xs:element name="videos">
		<xs:complexType>
			<xs:sequence>
				<xs:element minOccurs="0" maxOccurs="3" ref="video" />
			</xs:sequence>
		</xs:complexType>
	</xs:element>
	<xs:element name="tipo" type="xs:string" />
	<xs:element name="horario">
		<xs:complexType>
			<xs:simpleContent>
				<xs:extension base="xs:string">
					<xs:attribute name="fecha-inicio" type="xs:string" />
					<xs:attribute name="hora-inicio" type="xs:string" />
					<xs:attribute name="duracion" type="xs:string" use="required" />
				</xs:extension>
			</xs:simpleContent>
		</xs:complexType>
	</xs:element>
	<xs:element name="gestion" type="xs:string" />
	<xs:element name="lugar" type="xs:string" />
	<xs:element name="direccion" type="xs:string" />
	<xs:element name="coordenadas">
		<xs:complexType>
			<xs:simpleContent>
				<xs:extension base="xs:string">
					<xs:attribute name="longitud" type="xs:string" use="required" />
					<xs:attribute name="latitud" type="xs:string" use="required" />
					<xs:attribute name="altitud" type="xs:string" use="required" />
				</xs:extension>
			</xs:simpleContent>
		</xs:complexType>
	</xs:element>
	<xs:element name="texto" type="xs:string" />
	<xs:element name="puntuacion" type="score-type" />

	<xs:simpleType name="score-type">
		<xs:restriction base="xs:string">
			<xs:enumeration value="0"/>
			<xs:enumeration value="1"/>
			<xs:enumeration value="2"/>
			<xs:enumeration value="3"/>
			<xs:enumeration value="4"/>
			<xs:enumeration value="5"/>
			<xs:enumeration value="6"/>
			<xs:enumeration value="7"/>
			<xs:enumeration value="8"/>
			<xs:enumeration value="9"/>
			<xs:enumeration value="10"/>
		</xs:restriction>
	</xs:simpleType>

	<xs:element name="referencia" type="xs:string" />
	<xs:element name="distancia-anterior">
		<xs:complexType>
			<xs:simpleContent>
				<xs:extension base="xs:string">
					<xs:attribute name="unidades" type="xs:string" use="required" />
				</xs:extension>
			</xs:simpleContent>
		</xs:complexType>
	</xs:element>
	<xs:element name="foto" type="xs:string" />
	<xs:element name="video" type="xs:string" />
</xs:schema>